microfinance_bank,microfinance_address
UNAAB Microfinance Bank Limited,University of Agriculture Abeokuta Abeokuta Ogun State
Ungogo Microfinance Bank Limited,Ungogo Local Government Area Council Kano Kano State
Unibadan MIcrofinance Bank Limited,1 Elkanemi Road University of Ibadan Ibadan Oyo State Nigeria
UNICAL Microfinance Bank Limited,University of Calabar P.M.B. 115 Calabar Cross Rivers State
Unicredit Microfinance Bank LImited,7A/9A Abibu Oki Street Lagos Island
UNIFA Microfinance Bank Limited,C/O Co-operative Shopping Centre Olotu Road UghelliDelta State
Unifund Microfinance Bank Limited,Suite 9/10 Block C P.O.W.A Shopping Complex Nyanya FCT ABUJA
Unilorin Microfinance Bank LImited,Permanent Site of University of Ilorin Kwara State
UNIMAID Microfinance Bank Limited,University of Maiduguri Campus Maiduguri Borno State
United Microfinance Bank Limited,No. 2 Udumofa Quarters Ekpan Warri Delta State
UNIUYO Microfinance Bank Limited,Cooperative House University of Uyo Akwa Ibom State
UNN Microfinance Bank Limited,University of Nigeria Nsukka Enugu State
Unubi Microfinance Bank Limited,UMBL House Afor Market Square Unubi Nnewi South L.G.A Anambra State
Unyogba Microfinance Bank Limited,1 Alloma Road Opposite Market Square Ejule Ofu LGA Kogi State
Urban Microfinance Bank Limited,62 Onyuke St Ogui Layout Enugu Enugu State
Ure Microfinance Bank Limited,Kaduna-Lissam Takum Taraba State
Uromi Microfinance Bank Limited,76 Ubiaja Road Uromi Edo State
Utako Microfinance Bank Limited,Samuelson Court Plot 1151 Ajose Adeogun Street Utako Abuja
Utuh Microfinance Bank Limited,Oye Market Square Utuh Nnewi South LGA Anambra State
Uvuoma Microfinance Bank Limited,4 Holy Ghost Road Umuahia Abia State
Uvuru Microfinance Bank Limited,Orie Ovuru Market Square Mbaise L.G.A Imo State
Uvwie Microfinance Bank Limited,214 Effurun - Warri Road By Jakpa Junction Effurun Delta State.
Uzondu Microfinance Bank Limited,St. Mary's Catholic Parish Compound Arthur Eze Avenue Awka Anambra State
Uzuakoli Microfinance Bank Limited,37 Market Road Uzuakoli Abia State.
Vantage Microfinance Bank Limited,No. 20 Isiukwuato Street Prefab-Owerri Imo State
VCL Microfinance Bank Limited,70. Abeokuta Rd. Agege Lagos
Verdant Microfinance Bank Limited,48. Banigbose Street Lagos Island. Lagos State
Verite Microfinance Bank Limited,51/51 Marina Street Lagos Island. Lagos State
VFD Microfinance Bank Limited,FORSIGHT HOUSE. 163/165. BROAD STREET.LAGOS ISLAND LAGOS STATE
Vibrant Microfinance Bank Limited,OKOWI HOUSE. OGBE-AKPU QUATERS. ISELLE AZAGBA ANIOCHA NORTH L.G.A DELTA STATE.
Victory Microfinance Bank Limited,Tran-Nsiki Federal Housinh Estate. GRA 3-3 Onitsha. Onitsha North L.G.A Anamra State.
Vineland Microfinance Bank Limited,Suite EU6. 01/02. The Arena. Nigerian Army Shopping Complex. Bolade.Oshodi. Lagos State
Visa Microfinance Bank Limited,Gouba Plaza. Plot 171. A.E. Ekukinam Street. Utako. Abuja.
Viscount Microfinance Bank Limited,Extention B1. Efab Mall. Area.11 Garki Abuja
Viva Microfinance Bank Limited,Suite H528/H529 Ikota Shopping Complex Victoria Garden City Ajah Lagos State
Waila Microfinance Bank Limited,No.7. Chrisgold Plaza Keffi Road. Mararaba Nassarawa State
Wapo Microfinance Bank Limited,Nagazi Ogaminana Okene. Kogi State.
Warji Microfinance Bank Limited,Emir's Drive Katanga P.O.BOX 3736 Bauchi State.
Wase Microfinance Bank Limited,1. Opposite Emir's Palace. Wase Local Govt Area. Plateau state
Wealth-Basket Microfinance Bank Limited,148. Lagos Road By Church Bustop. Ikorodu. Lagos State.
Wealth-Stream Microfinance Bank Limited,213. Kirikiri Road. Olodi-Apapa. Lagos State.
Welfare Microfinance Bank Limited,Abdulwahab Folawiyo Road Ilorin. Kwara State.
Wesley (fmr City Mission Methodist) Microfinance Bank Limited,1. Alhaji Ade Thanni Street. Sururlere. Lagos
West-End Microfinance Bank Limited,11. Community Road. Igbesa. Ado Odo L.G.A
Wetland Microfinance Bank Limited,38. Deco Road. Warri. Delta State
Woliwo Microfinance Bank Limited,10. Akunnia Njota Street. Woliwo Layout Onitsha Anambra State.
Women Development Initiative Microfinance Bank Limited,3rd Floor. Kano Foundation Building. Bayero Univerity. Kano State.
WRA Microfinance Bank Limited,Wararwa Town. Warawa Local Govt Area. Kano State
Wudil Microfinance Bank Limited,No.2. Aliu Dandarman Road. Wudil. Kano State
XSLNCE Microfinance Bank Limited,No.8B Olarenwaju Ninalowo Off Fola Osibo Street Lekki Phase 1. Lekki Lagos
Yabo Microfinance Bank Limited,No.3. Shehu Shagari Road. Yabo. Sokoto state
Yankari Microfinance Bank Limited,No. 10. Yandoka Road Bauchi.
Yauri Emirates Microfinance Bank Limited,Old Kotangora Road. PP.O.BOX.1 Yelwa-Yauri. Kebbi State
YCT Microfinance Bank Limited,Yaba Colledge of Technology. 22 Husley Street Yaba
Yeneng Microfinance Bank Limited,P.O.BOX 1001. Bukuru. No.1 Bank Road Ganawuri. Riyom L.G.A Plateau State
Yarwa Microfinance Bank Limited,No.15. Ahmadu Bello Way. Maiduguri. Borno State
YES Microfinance Bank Limited,11 Majekodumi Street. Off Allen Avenue. Lagos
Yield Microfinance Bank Limited,Â 483C Omotunde Akinsola Street Omole Phase 1 Ikeja Lagos
Yobe Microfinance Bank Limited,Plot 4. Ahmadu Bello Way Damaturu Yobe State
Zafec Microfinance Bank Limited,Federal Colledge of Education Campus. Zaria Kaduna State
Zamare Microfinance Bank Limited,Yauri LGA Keebi
Zawadi Microfinance Bank Limited,Shelter Market. Oyo. Akwa Ibom State
Zazzau Microfinance Bank Limited,Yantabimi Quaters. Zaria City. Kaduna State
Zigate Microfinance Bank Limited,12. Station Road. Agbado. Ogun State
Zion Microfinance Bank Limited,144. Benue Crescent Wadata. Makurdi Benue State
Zumwa Microfinance Bank Limited,Anguwara Sarki Sabon Wuse. Niger State
Zurmi Microfinance Bank Limited,Market Road. Zurmi. Zamfara State
Zuru Microfinance Bank Limited,Opposite Zuru GarageZuru. Kebbi State