microfinance_bank,microfinance_address
Navy Microfinance Bank Limited,Garki Modern Market Section 4 Shop 6 Block 4 Garki Abuja
Ndiagu Microfinance Bank Limited,101 Ogoja Road Ndiagu LayoutAbakiliki Ebonyi State
Ndiolu Microfinance Bank Limited,Parmanent Site Government House P.M.B. 6031 Awka Anambra State
Ndiorah Microfinance Bank Limited,1 Okosisi Lane New Parts Market Nkpor Onitsha Anambra State.
Nenzit Microfinance Bank Limited,Samaru-Kataf Round-About Zamaru-Kataf Zango-Kataf Kataf LGA Kaduna State
Network Microfinance Bank LImited,68 Ayangburen Road P.O.Box 2525 Ikorodu Lagos
Neu-Kom Microfinance Bank Limited,BLK C14 C15 C46 BANEX PLAZA PLOT 641 AMINU KANO CRESCENT WUSE II ABUJA
New Age Microfinance Bank Limited,Old UAC Building Osele Market Ikare Ondo State
New Era Microfinance Bank Limited,Bolorunpelu Market Lanlante Oyo State
New Golden Pastures Microfinance Bank Limited,197 Warri/Sapele Road Warri Delta State.
New Vision Microfinance Bank Limited,Takie Square Ilorin Road Ogbomosho Oyo State.
New World Microfinance Bank Limited,No 1 Salhi Road Birnin-Kudu L.G.A Jigawa State.
Ngala Microfinance Bank Limited,Along Main Road Gamboru-Ngala Borno State
Ngbo Microfinance Bank Limited,NKWO MGBO MARKET SQUARE OHAUKWU L.G.A. EBONYI STATE
Nice Microfinance Bank Limited,P.M.B.2002 Awka South LGA Anambra State
Nigerian Prisons Microfinance Bank Limited,71 Nigerian Prisons Complex Agodi Ibadan Oyo State.
Ni'ima Microfinance Bank Limited,Bagudo Town Bagudo Local Government Kebbi State
Ningi Microfinance Bank Limited,4 Bank Road Ningi LGA Bauchi State
Nkpa Microfinance Bank Limited.,Amaohoro Nkpa Bende L.G.A Abia State.
Nkpologwu Microfinance Bank Limited,Eke Market Nkpologwu P.M.B.25 Aguata Anambra State
Nkpolu-UST Microfinance Bank Limited,University of Science & Technology Port Harcourt Rivers State.
NNEW Women's Microfinance Bank,70 Ogunnusi Road Akiode Bustop Ojodu Lagos State
Nnokwa Microfinance Bank Limited,Eke Nnokwa Market Square P.O.Box 155 Nnokwa Anambra State
Noble Microfinance Bank Limited,22 Agulu Avenue Amafor West Nkpor Agu Anambra State
Nopov Microfinance Bank Limited,1 Uwor Street Ogbeowele Ibusa Delta State
North Capital Microfinance Bank Limited,Unguwar Sarki Batasari Batsari Local Govt Area Katsina State
Northbridge Microfinance Bank Limited,Dantata Shopping Plaza Ibrahim Taiwo Road Murtala Muhammed Way P.O.Box2866 Kano Kano State
NOUN (National Open University) Microfinance Bank,Temmiya Jummat Mosque Dei-Dei/Dakwa Road Abuja no 5 Daresalam Wuse 2 Abuja Limited
Novel Microfinance Bank LImited,123 Apapa Road Ebute Metta Lagos State.
NPF Microfinance Bank Limited,1 Ikoyi Road Obalende Lagos State
Nri Microfinance Bank Limited,Eke Market Square Nri Anaocha Local Govt Area Anambra State.
Nsehe Microfinance Bank Limited,115 Ikot Ekpene Road P.M.B.1168 Uyo Akwa Ibom State.
Nsu Microfinance Bank Limited,Orieagu-Umuahia Road Umuakagu Nsu Ehime Mbano L.G.A Imo State
Nsukka Township Microfinance Bank Limited,69 Enugu Road Nsukka Enugu State
Numo Microfinance Bank Limited,Umueze Umunumo Ehime Ehime Mbano Local Govt Area Imo State.
Nun Microfinance Bank Limited,KM25 Mbiama/Yenegoa Road Yenizue-Crene Yenagoa Bayelsa State.
NUT Endwell Microfinance Bank Limited,Af. 19 Gwandu Road Kaduna Kaduna State
Nwabosi Microfinance Bank Limited,Isiekenesi Ideato South Local Govt Area Imo State.
Nwannegadi Microfinance Bank Limited,51 Bishop Shenahan College Road Orlu Imo State.
OAF Microfinance Bank Limited,NO. 76 Akinjide Plaza 4th Floor Adekunle Fajuyi Road Adamasingba Mokola Ibadan Oyo State
Oakland Microfinance Bank Limited,Sokedile House Oka Akoko South LGA Ondo State.
Oba Microfinance Bank Limited,Afor Oba Market Square Oba Idemili L.G.A Anambra State
Obafemi Awolowo University Microfinance Bank Limited,Oduduwa Hall Complex Obafemi Awolowo University Osun State.
Obeledu Microfinance Bank Limited,Jemko House Obeledu-Igbo Ukwu Road Anaocha LGA
Obodoukwu Microfinance Bank Limited,Ideato North Local Govt Area Imo State.
Obokun Microfinance Bank Limited,Adeyemi House Ogo Agbala Street Ibokun Osun State
Obollo Microfinance Bank Limited,21 University Road Obollo-Afor Udenu L.G.A Enugu State.
Obosi Microfinance Bank Limited,Mike Ajaegbo Road Obosi Idemili L.G.A Anambra
Obudu Microfinance Bank Limited,No. 1 Ranch Road Obudu Cross River State.
Oche Microfinance Bank Limited,Plot 5 Futo Road Nkwo-Ukwu Ihiagwa Market Owerri West Imo State.
OCON Success Microfinance Bank Limited,Fakeye Area Oja-Odan Yewa North Ilaro Ogun State.
Octopus Microfinance Bank Limited,24 Community Road Opp. Police Station Otto-Ijanikin Km 28 Badagry Expressway Lagos
Odoakpu Microfinance Bank Limited,81 Bida Road P.O.Box 548 Onitsha Anambra State
Odu Microfinance Bank Limited,Anyigba-Dekina Road P.O.Box 35 Odu Dekina Kogi State
Oduduwa Microfinance Bank Limited,5B Aderemi Road Ile-Ife Osun State.
Ogbe-Ahiara Microfinance Bank Limited,Onugot House Afor Ogbe MarketP.O.Box 54 Ogbe Ahiara Ahiazu Mbaise Imo State
Ogberuru Microfinance Bank Limited,Eke Market Square Ogberuru Imo State.
Ogbete Microfinance Bank Limited,Local Govt Building Ogbete Main Market Ogbete Enugu State
Ogboefere Microfinance Bank Limited,Ogboefere Market P.O. Box 11002 Onitsha Anambra State
Ogidi Microfinance Bank Limited,Akpakaogwe Old Enugu/Onitsha Road Ogidi Anambra State
Ogige Microfinance Bank Limited,20 Market Road Alu Dele Nsukka Enugu State.
Ogiyan Microfinance Bank Limited,Opposite Central Mosque Oja-Oba Ejigbo Osun State
Ogoja Microfinance Bank Limited,27 Mission Road Igoli- Ogoja Cross River State.
Ohafia Microfinance Bank Limited,122 Arochukwu Road Ohafia Abia State
Ohambele Microfinance Bank Limited,Ukwa East L.G.A Abia State.
Ohha Microfinance Bank Limited,No. 1 Ogui Road Enugu Enugu State
Ohon Microfinance Bank Limited,Aiyeunle-Gbedde Ijumu L.G.A Kogi State
Oja Tesan Egbeda Microfinance Bank Limited,2 Station Market Road Erunmu Egbeda L. G. A Ibadan Oyo State
Ojokoro Microfinance Bank Limited,Lagos-Abeokuta Express Ijaiye Bus Stop Ojokoro Lagos State
Okada Microfinance Bank Limited,Â  1 Mission Road Okada Ovia North East L.G.A Edo State NigeriaÂ 
Okeagbe Microfinance Bank Limited,A2 Rufus Giwa Road Afa Okeagbe Ondo State
Okebola NUT Microfinance Bank Limited,Oke-Bola Teachers' Cooperative House Opposite St. Theresa's College Oke-Ado IbadanOyo State
Okengwe Microfinance Bank Limited,1 Lagos Road c/o Okengwe P.A Ozuja Ward Okengwe Okene Kogi State
Oke-Oba Microfinance Bank Limited,Ogbomoso-Igbeti Road Tewure Orire Local Govt Area Ogbomosho Oyo State
Oko Microfinance Bank Limited,Bank House Opposite Federal Polytechnic Oko Orumba North L.G.A Anambra State
Okpe Microfinance Bank Limited,Old Market Square (Afieyi) Oha Orerokpe Okpe Local Govt Area Delta State
Okpofe Microfinance Bank Limited,Afor Ekiri Market Square Ezin-ihitte Mbaise Imo State.
Okpoga Microfinance Bank Limited,Bank Road Ugwu-Okpoga Okpokwu L.G.A Benue State
Okporo Microfinance Bank Limited,Okporo Postal Agency Building Okporo-Orlu L.G.A Imo State
Okuku Microfinance Bank Limited,Oba Oyinlola Way Okuku Osun State.
Okuta Microfinance Bank Limited,75 Akpakpava Road Benin City Edo State
Okwo-Oha Microfinance Bank Limited (formerly Izzi MFB Ltd),Iboko Town Izzi Local Government Area Ebonyi State.
Ola Microfinance Bank Limited,No. 1 Bank Road Ola Ejigbo Local Govt Area Osun State
Olabisi Onabanjo University Microfinance Bank Limited,Mini Campus Olabisi Onabanjo University Ago Iwoye Ogun State
Olive Microfinance Bank Limited,150 Obafemi Awolowo Way Ikeja
Olofin Microfinance Bank Limited,2 Moore Street Ile-Ife Osun State.
Olofin-Owena Microfinance Bank Limited,NO.1 MARKET STREET OWENA IJESHA ORIADE L.G.A. OSUN STATE
Ologbon Microfinance Bank Limited,P.O. BOX 844 Ologbon Area Osogbo Road Ogbomoso Oyo State.
Olowolagba Microfinance Bank Limited,P.O.BOX 170 Deborah House Sabo Ogbomoso Oyo State
Olu-Basiri Microfinance Bank Limited,205 Old Ikirun Road Sabo Junction Oshogbo Osun State
Oluchukwu Microfinance Bank Limited,Bethany House1 Akor Street Onitsha Anambra State
Omak Microfinance Bank Limited,33 Station Road Oshogbo Osun State
Omiye Microfinance Bank Limited,Co-operative Building Market Square Ilupeju-Ekiti Ekiti State
Omu Microfinance Bank Limited,1 Otunba Gbenga Daniel Road Omu Ijebu Ogun State.
Omu-Aran Microfinance Bank Limited,92 Aperan Road P.M.B 1037 Omu-Aran Kwara State.
Omuma Microfinance Bank Limited,Bank House Omuma Market Square Omuma Oru East L.G.A Imo State
Onibu-Ore Microfinance Bank Limited,SW9/90 Dogo Bus Stop Apata Ibadan Oyo State.
Onima Microfinance Bank Limited,Onicha Ezin Ihitte Mbaise Local Govt Area Imo State
Onyx Microfinance Bank Limited,Igbehinadun Street By Bolade B/Stop Oshodi Lagos
Oraezue Microfinance Bank Limited,3 Igwieke Odu Street Onitsha Anambra State
Oraukwu Microfinance Bank Limited,P.O.Box 127 Oraukwu Town Idemili LGA Anambra State
,
Oredegbe Microfinance Bank Limited,42 Igbalaye Street Idanre Road Oke-Aro Ondo State
Orie-Orba Microfinance Bank Limited,1 Obollo Road Orba Udenu Local Govt AreaEnugu State
Orilonise Microfinance Bank Limited,Agbeni Market Ibadan South West Local Government Area of Oyo State
Orisun Microfinance Bank Limited,16 Meleki Street Olusegun Osoba Way Ago Iwoye Ogun State
Orita Basorun Microfinance Bank Limited,Plot 1 Salami Layout Orita Basorun Ibadan Oyo State
Orokam Microfinance Bank Limited,PMB 01 Orokam Ogbadigbo LGA Benue State
Oroke Microfinance Bank Limited,Ibaka Quarters Ikare Road Akungba Akoko Ondo State
Oros Capital Microfinance Bank Limited,17 Commercial Avenue Yaba Lagos State
Orsuihiteukwa Microfinance Bank Limited,Ekeututu Market Square Orsuihiteukwa Orsu L.G.A Imo State
Osanta Microfinance Bank Limited,Dibu Ojerinde House Ajegunle Oke-Afin Igboho Orelope L.G.A Oyo State
OSCT Microfinance Bank Limited,Osun State College of Technology Esa Oke Osun State
Osi Microfinance Bank Limited,Egbe Road Osi Ekiti Local Govt Area Kwara State
Osina Microfinance Bank Limited,Afor Osina Ideato North Local Govt Area Imo State
Osogbo Microfinance Bank Limited,Opposite Osun State Hospital Management Board New Orisumbare Market Oshogbo Osun State
Osomhe Microfinance Bank Limited,Mission Road Iyhiochia Quarters Fugar Edo State
Ospoly Microfinance Bank Limited,Osun State Polytechnic Campus Iree Osun State
Osumenyi Microfinance Bank Limited,Eke Market Square P.O.Box 191 Osumenyi Nnewi South LGA Anambra State.
Otukpo Microfinance Bank Limited,7 Makurdi Road Otukpo Benue State
Otuo Microfinance Bank Limited,Oluma Quarters Otuo Afuze Owan East Local Govt Area Edo State
Ours Microfinance Bank Limited,23/25 Olofa Way Offa Kwara State
Ovidi Microfinance Bank Limited,1 Attah Road Okene Kogi State
Owotutu Microfinance Bank Limited,23 Ladipo Street Mushin Lagos
Oyan Microfinance Bank Limited,Oyan Asaba Road Owode Market Square Oyan Osun State.
Ozizza Microfinance Bank Limited,No. 1 Water Works Road Abakiliki Ebonyi State.
Pace-Setter Microfinance Bank Limited,Confidence Motors Office Complex Sabo Ojoo Ibadan Oyo State
Page Credit Microfinance Bank Limited,18 Norman Williams Street Ikoyi Lagos State
Palmcoast Microfinance Bank Limited,3 Awka Efak Street Uyo LGA Akwa-Ibom State.
Pana Microfinance Bank Limited,Former Bank of the North Building Opp. U.K. Bello Primary School Paiko Niger State.
Parallex Microfinance Bank Limited,55 Kudirat Abiola Way Oregun-Ikeja
Parkway Microfinance Bank Limited,102/109 Broad Street Mandilas Building Lagos Lagos Island
Partnership Microfinance Bank Limited,5b Oguta Road Onitsha Anambra State
Pathfinder Microfinance Bank Limited,Osogbo Road Temidire Okejigbo Ila Orangun Osun State
Patrickgold Microfinance Bank Limited,No.95 Old Abeokuta Motor Road Opp. Post Office Agege Lagos
Peace Microfinance Bank Limited,Utako District Abuja
Pearl Microfinance Bank Limited,6 Taiwo Ishola Street Off Lola Holloway Street Omole Phase 1 Ojodu Lagos
Pecan Trust Microfinance Bank Limited,Plot 5a No 32 Grace Anjous Lekki Phase 1 Lekki Lagos
Peniel Microfinance Bank Limited,Km 20 Badagry Expressway Opp. LASU Main Gate Ojo LGA Lagos State
Peninsula Microfinance Bank Limited,1ST FLOOR CONOIL BUILDING BUDO LAYOUT AJIWE AJAH-LEKKI EXPRESS WAY LAGOS STATE
Pennywise Microfinance Bank Limited,C/o Mrs Monotimbo Ayinde95 Awolowo Road Lagos State
Pentecost Microfinance Bank Limited,DCC (Anglican Communion) 10-16 Nnobi Road Nnewi Anambra State
Peoples Microfinance Bank Limited,Orofia Industrial Layout Abagana Njijoka LGA Anambra State
Personal Trust Microfinance Bank Limited,67 Ogunlana Drive SuruLere Lagos
Petra Microfinance Bank Limited,St. Dominic Priory; 356 Herbert Macaulay Way Yaba Lagos State
Phoenix Microfinance Bank Limited,IBB Market GRA Road P.M.B. 65 Suleja Niger State
Pillar Microfinance Bank Limited,Plot 12 Julius Nyerere Crescent Asokoro Abuja FCT
Polybadan Microfinance Bank Limited,The Polytechnic Ibadan Ventures P.M.B. 22 U.I. Post Office Ibadan Oyo State
Polyunwana Microfinance Bank Limited,Akanu Ibiam Federal Polytechnic Unwana Afikpo Ebonyi State
Premium Microfinance Bank Limited,202 Olu-Obasanjo Road Port-Harcourt Rivers State
Primera Credit Microfinance Bank Limited,385 Ikorodu Road Ojota Lagos State
Prisco Microfinance Bank Limited,Enugu
Progressive Link Microfinance Bank Limited,Isanlu Yagba East Local Government Area Kogi State
Prolific Microfinance Bank Limited,9 Ijaiye Road Sango-Agege Lagos State
Prospects Microfinance Bank LImited,C/O J.J. Akpan; 93 Udo Umana StreetUyo Akwa Ibom State
Prosperity Microfinance Bank Limited,1 Siluko Road Benin City Edo State
Providence Microfinance Bank Limited,Suite 3; 21 Ogundana Street Off Allen Avenue Ikeja
Prudential Cooperative Microfinance Bank Limited,Km 5 Uyo-Ikot Ekpene Road Essien Udom L.G.A. Akwa Ibom State
Purple Money Microfinance Bank Limited,Plot 69 Admiralty Way Lekki Phase 1 Lagos
Pyramid Microfinance Bank Limited,Spicery Building 11/13 Onayade Street Igbobi Sabe Jibowu Lagos
Quicash Microfinance Bank Limited,Plot 5A Block A10 Admiralty Way Lekki Phase 2 Lekki Lagos
Rakib Microfinance Bank Limited,Kibiya Town Kibiya L.G.A Kano State
Randalpha Microfinance Bank Limited,P.O.BOX.1921 Randa Area Behind Baptist Seminary Ogbomoso Oyo State
Ranmilowo Microfinance Bank Limited,Apinnite Area Saki Oyo State
Rano Microfinance Bank Limited,RANO MFB RANO TOWN KANO LOCAL GOVERNMENT AREAS KANO STATE
Rayyan Microfinance Limited,Â Plot1 Beside Bama Motor Park Bama Road Maiduguri Borno State
Reality Microfinance Bank Limited,Reality House Oladele George Street By AP Filling Station Sawmill Old Ife Road Ibadan Oyo State
Regent Microfinance Bank Limited,Plot 1186 Cadastral Zone B06 Mabushi District Along Kado Expressway Abuja
Rehoboth Microfinance Bank Limited,13 Aweh Crescent Onipanu Shomolu Lagos
Reliance Microfinance Bank Limited,Plot 4 Oyetubo Street Off Obafemi Awolowo Road Ikeja Lagos
RenMoney (Rencredit) Microfinance Bank Limited,89 Awolowo Road Ikoyi Lagos
Rephidim Microfinance Bank Limited,No 10 Lateef Salami Street Ajao Estate Lagos
RIC Microfinance Bank Limited,1 Adeola Hopewell Street Victoria Island
Richway Microfinance Bank Ltd,Plot 27 Admiralty Way Lekki Phase 1 Lekki Lagos State
Riggs Microfinance Bank LImited,5 Imam Abib Adetoro Street Off Ajose Adeogun Victoria Island
RIMA Growth Pathway Microfinance Bank Limited,STATE SECRETARIATE (Podium Building) PORTHARCOURT RIVERS STATE
Rima Microfinance Bank limited,Sambo Road S/Gari Goronyo P.M.B. 02355 Sokoto Sokoto State
Rimin Gado Microfinance Bank Limited,10 Rimin Gado Town Kano State
Ringim Microfinance Bank Limited,Opp. Ringim Central Market Ringim LGA Jigawa State
Riverside Microfinance Bank Limited,Market Road Ado Odo Ogun State
Rockshield Microfinance Bank Limited,Olorunfemi Plaza 398 Ikorodu Road Ojota Lagos
Rogo Microfinance Bank Limited,Rogo Town Rogo Local Govt. Area. Kano State
Royal Blue Microfinance Bank Limited,127 Herbert Macaulay Street Ebute-Metta
Royal Child Heritage Microfinance Bank Ltd,No. 5 Kokoma Close Wuse 2 Abuja
Royal Exchange Microfinance Bank Limited,34/36 Apapa-Oshodi Expressway Charity Bus Stop Oshodi Lagos
Royal Life Key Microfinance Bank Limited,No. 1 Ekukinam Street Opposite Utako Modern Market Utako Abuja FCT
Royal Microfinance Bank Limited,No. 7 King Jaja Street Borokiri Port Harcourt Rivers State.
Sabon Yelwa Microfinance Bank Limited,85 Kachia Road Sabon Tasha Kaduna
Sabuwa Microfinance Bank Limited,NO. 10 SABUWA TOWN SABUWA L. G. A. KATSINA STATE
Sadau Microfinance Bank Limited,2 Kofar Fada Road Itas Bauchi State
Safe Haven Microfinance Bank Limited,Block B-SB1 2 Heroes Plaza145 Adetokunbo Ademola Crescent Wuse II Abuja
Safegate Microfinance Bank Limited,1st Floor No. 26 Obafemi Awolowo Way Ikeja Lagos State
Safeline Microfinance Bank Limited,50 LIBREVILLE STREET OFF AMINU KANO CRESCENT WUSE II ABUJA
Sagamu Microfinance Bank Limited,67 Ewusi Street Sagamu
Sal-Fol Microfinance Bank Limited,25 Ibadan Municipal Shopping Complex Bank Road Bodija Oyo State
Sanchi Microfinance Bank Limited,
Sandamu Microfinance Bank Limited,9 Sandamu Town Sandamu Local Government Katsina
Sanga Microfinance Bank Limited,Abubakar Maiko House Akwanga Road Sanga LGA Kaduna State
Santrust Microfinance Bank Limited,314B Akin Ogunlewe Street Off Ligali Ayorinde Victoria Island Lagos
Sapida Microfinance Bank Limited,Oja Ijebu Imusin Ijebu East Ogun State
Sapphire Microfinance Bank Limited,111 Abak Road Uyo Akwa Ibom State.
Sarkin Kudu Microfinance Bank Limited,NO. 16 DANJA TOWN DANJA L.G.A. KATSINA STATE
Savings Corp Microfinance Bank Limited,Plot D43 Lagos Crescent Off Ladoke Akintola Boulevard Opposite Entrance to Garki Model Market Garki Abuja
Saviour Microfinance Bank Limited,141 Owerri Road Okigwe Imo State
SBDC Microfinance Bank LImited,Investment House Ring Road Benin-City Edo State
SEAP Microfinance Bank Limited,2/404 Adeoye Agbadudu Road Ibadan Oyo State
Seed Capital Microfinance Bank Limited,2 Montgomery Road Yaba
Seedvest Microfinance Bank Limited,15 Awolowo Way J. Allen Area Dugbe Ibadan
Senchi Microfinance Bank Limited,Senchi Town Zuru Local Government Area Kebbi State
Sepeteri Microfinance Bank Limited,Saki Road Idi-Emi Saki East Local Govt Area Oyo State
Shanono Microfinance Bank Limited,Shanono L.G.A Kano State
Shelter Microfinance Bank Limited,24 Ado Badore Road Ajah Lekki-Epe Expresway Lagos State
Shepherd Trust Microfinance Bank Limited,22 Thomas Salako Street Ogba Ikeja Lagos State
Shield Microfinance Bank Limited,Obada Market Ilara Mokin Ifedore Local Govt Area Ondo State
Shinkafi Microfinance Bank Limited,15 Sabon Birni Road Shinkafi Zamfara State
Shongom Microfinance Bank Limited,Off Yola Road Kaltungo Gombe State
Shoreline Microfinance Bank Limited,10 Aerodrome Road Apapa Apapa L.G.A Lagos
Sincere Microfinance Bank Limited,145 Olofa Way Offa Kwara State.
Sky-line Microfinance Bank Limited,No.2 Baba Street Abuja-Keffi Road New Karu Opp. Conoil Filling Station By Abacha RoadPO Box 7473 Abuja Mararaba Nasarawa State.
SLS Microfinance Bank Limited,FF 105 MKK Complex Gudu Market Complex Junction Gudu District Abuja FCT
Snow Microfinance Bank LImited,118 Coker Road Ilupeju Lagos
Solid Allianz Microfinance Bank Limited,NO 1 ANUOLUWAPO STREET SOMOLU LAGOS
Solid Base Microfinance Bank Limited,Okedagba Quarters Opposite Baptist High School Ekinri Adde Ijumu L.G.A Kogi State
Solid Rock Microfinance Bank Limited,17 Ijemo Agbadu Road Agoko Abeokuta Ogun State.
Sovereign Microfinance Bank Limited,45 Isolo Road Mushin Lagos State
Spec Microfinance Bank Limited,Block 23 Algeria Street Behind Neighbourhood Centre Wuse Zone 3 Abuja
Splendid Microfinance Bank Limited,75 Aguiyi Ironsi Street Maitama District Abuja
Stako Microfinance Bank Limited,74 Mobil Road Ajegunle Apapa LGA Lagos State
Stallion Microfinance Bank Limited,38 Ogunlana Drive Surulere Lagos State
Standard Microfinance Bank Limited,Bornoma House No 94 Mohammed Mustapha Way Jimeta-Yola Adamawa State
Stanford (Formerly Merchants) Microfinance Bank Limited,PLOT 115 F LINE EWET HOUSING ESTATE UYO AKWA IBOM STATE
Star Microfinance Bank Limited,45 Samson Odugbesan Street Oke-Ala Ososa-Ijebu Ogun State.
Stateside Microfinance Bank Limited,2 Creek Road ApapaLagos State.
Still Waters Microfinance Bank Limited,NO. 1/3 CREEK ROAD APAPA LAGOS STATE
Stockcorp Microfinance Bank Limited,95 Olofa Way Offa Kwara State
Suisse Microfinance Bank Limited,Gacoun Plaza 2nd Avenue 23 Road K Close Festac Town Lagos State.
Sulspap Microfinance Bank Limited,275 Egbeda Idimu Road Pipeline Bus-Stop Opposite Area M Police Command Isheri Idimu
Sumaila Microfinance Bank Limited,Sumaila Town Sumaila L.G.A. Kano State
Sunbeam Microfinance Bank Limited,1 Ugbonhan Street Efon Alaye Ekiti State.
Sunrise Microfinance Bank Limited,6 Ajayi Aina Street Ifako-Gbagada Lagos State
Support Microfinance Bank Limited,22 Isheri North Road Isheri Estate Ifo-Otta LGA Ogun State.
Supreme Microfinance Bank Limited,2A Alhaja Abass Street Alhaja Bus Stop Ogudu GRA- Ogudu Ojota Lagos
Sure Anchor Microfinance Bank Limited,No 50 Chief S.N. Okeke Road by Cathedral Church Amichi Nnewi South LGA Anambra
Surelife Microfinance Bank Limited,88 HOSPITAL ROAD KHANA LOCAL GOVT. AREA RIVERS STATE
Susu Microfinance Bank Limited,34 Commercial Avenue Sabo-Yaba Lagos State
Swift Microfinance Bank Limited,96 Asa Road P.M.B 7287 Aba Abia State
Takai Microfinance Bank Limited,Takai L.G.A Kano State
Tanadi Microfinance Bank Limited,ALONG ZUNGERU-BIDA ROAD EMIWORO WUSHISHI NIGER STATE
Tangale Microfinance Bank Limited,60 Gombe-Yola Road Billiri Gombe State.
Taraba Microfinance Bank Limited,19 Ahmadu Bello Way Jalingo Taraba State.
Tasued Microfinance Bank Limited,Tai Solarin University of Education Ijebu-Ode Ogun State
Tattali Microfinance Bank Limited,Kaduna Lagos Road Makera Mashegu L.G.A Niger State.
Taura Microfinance Bank Limited,No 1 Main Street Taura Jigawa State
TCF Microfinance Bank Limited,No 2A Osborne Road Pees Galleria Suite 4 1st Floor Ikoyi Lagps
The Millennium Microfinance Bank Ltd,No. 1 St. Paul University Premises ZIKS Avenue Awka Anambra
Tijarah Microfinance Bank Limited,TIJARAH MFB STABLE PLAZA2 MURTALA MOHAMMED WAY BAUCHI BAUCHI STATE
Time Microfinance Bank Limited,5 Kachia Road Adjacent Zenith Bank Kafanchan Kaduna State
Titare Microfinance Bank Limited,Marine Base Bus Stop Marine Base Port Harcourt Rivers State.
Tofa Microfinance Bank Limited,No. 1 Tofa Town Kano State
Toki Rainbow Microfinance Bank Limited,68 Nkpogu Street Off Trans Amadi Industrial Layout Port -Harcourt Rivers State
Topclass Microfinance Bank Limited,14 New Market Road Onitsha Anambra State
Total Trust Microfinance Bank Limited,19 Odunawo Street Onitsha Anambra State
Touchgold Microfinance Bank Limited,354 Abeokuta Expressway Abule Egba Agege Lagos State
Townserve Microfinance Bank LImited,2 TOS Benson Road Ikorodu Lagos State.
Transwealth Microfinance Bank Limited,16 Estate Hospital Road Dallimore Junction Ado-Ekiti Ekiti State
Treasures Microfinance Bank Limited,No 1 Bakare Street Ojodu-Berger Bus Stop Ojodu Lagos
Trident Microfinance Bank Ltd,3rd Floor Plot 1042 Kur Mohammed Street Central Business District Abuja
Trinity Microfinance Bank Limited,18 Moloney Street Obalende Lagos State
Tripple A Microfinance Bank Limited,AMAC JABI ABUJA FCT
Truebond Microfinance Bank LImited,27 Adeola Adeleye Street Off Coker Road Ilupeju Kosofe LGA Lagos State
Trust Microfinance Bank Limited,10 Local Govt Road Owode-Egba Ogun State.
Trustfund Microfinance Bank Limited,60 Adesuwa Road G.R.A Benin City Edo State
Tsanyawa Microfinance Bank Limited,Old People Bank Along Katsina Road Tsanyawa Kano State
TSM Microfinance Bank Limited,15A Adebisi Popoola Street Lekki Phase I Eti-Osa Lagos State
Tudun Wada Microfinance Limited,TUDUN WADA L.G.A. KANO STATE
U & C Microfinance Bank Limited,Choba Park Shopping Complex University of Port Harcourt Rivers State.
Ubulu Microfinance Bank Limited,Ogwashi-Uku-Umunede Road Ubulu-Uku Aniocha LGA Delta State
UCB Microfinance Bank Limited,Old Afor Market Square Umunya Oyi Local Govt Area Anambra State
Uda Microfinance Bank Limited,35 Market Road Eguare-Ekpoma Esan LGA Edo State
Udoka Microfinance Bank Limited,Nwagu Market Square Agulu Anaocha LGA Anambra State
Uga Microfinance Bank Limited,Oye Market Square P.O.Box 508 Uga Aguata LGA Anambra State
Ugboju Microfinance Bank Limited,Onyagede/Ankpa Rd Ogobia-Ugboju Road P.O.Box 1260 Otukpo Benue State
Ugborimili Microfinance Bank Limited,Ogbo-Ogwu Abuja Line Bridge Head Market Fegge Onitsha Anambra State
Ukpor Microfinance Bank Limited,Afor Ukpor Market Nnewi South LGA Anambra State
Ukwala Microfinance Bank Limited,Mike Ajegbo Street Obosi Anambra
Ulayin Microfinance Bank Limited,18 Okeyinmi Street P.O. Box 273 Ado-Ekiti Ekiti State
Uli Microfinance Bank Limited,KM 45 Onitsha-Owerri Road P.M.B.144Uli Anambra State
Ultimate Benefit Microfinance Bank Limited,150C Okene/Kabba Road Lokoja Kogi State
Ultimate Microfinance Bank Limited,Sikiru Ayinde Oluwo House Owode market Ayobo Road Ipaja Lagos State
Umejei Microfinance Bank Limited,124B Umujei Road P.M.B 1007 Ibusa Oshimilli LGA Delta State
Ummah Microfinance Bank Limited,Sokoto Street Yola Market Adamawa State
Umuawulu Microfinance Bank Limited,Umuawulu Awka South Local Govt Area Anambra State
Umuchinemere Procredit Microfinance Bank Limited,Plot 5 Ikwuato Street Uwani Enugu State
Umuchukwu Microfinance Bank Limited,6 Bende Road Umuahia Abia State
Umunnachi Microfinance Bank Limited,St. Theresa's Catholic Cathedral Church Ogoja Road Abakaliki Ebonyi State
Umunne Microfinance Bank Limited,3 Analikwu Road Nimo Njikoka Local Government Area Anambra State
Umuoji Microfinance Bank Limited,Nkpor/Umuoji Road Umuoji Idemili North Local Govt Area Anambra State
UMYU Microfinance Bank Limited,Umaru Musa Yar'Adua University KM 10 Dutsinma Road Katsina State
